{
  "schema_version": "2.0",
  "artifact_type": "venue_profile",
  "project_id": "coar-demo",
  "created_at": "2026-07-14T12:00:00Z",
  "updated_at": "2026-07-14T12:00:00Z",
  "extensions": {},
  "venue_name": "Example Venue",
  "contribution_patterns": [
    "Clear technical contribution."
  ],
  "evidence_standards": [
    "Traceable empirical evidence."
  ],
  "manuscript_expectations": [
    "Coherent claim hierarchy."
  ],
  "figure_table_expectations": [
    "Readable overview figure."
  ],
  "common_rejection_risks": [
    "Overclaiming beyond evidence."
  ],
  "requirements_evidence": [],
  "seed_papers": [],
  "profile_status": "draft"
}
